{
  "artifact_releases": [
    {
      "artifacts": [
        {
          "abi_tag": "cp312",
          "filename": "torch-2.8.0a0+gitfc14c65-cp312-cp312-win_amd64.whl",
          "package": "torch",
          "platform_tag": "win_amd64",
          "python_tag": "cp312",
          "url": "https://repo.radeon.com/rocm/windows/rocm-rel-6.4.4/torch-2.8.0a0%2Bgitfc14c65-cp312-cp312-win_amd64.whl#sha256=",
          "version": "2.8.0a0+gitfc14c65"
        },
        {
          "abi_tag": "cp312",
          "filename": "torchaudio-2.6.0a0+1a8f621-cp312-cp312-win_amd64.whl",
          "package": "torchaudio",
          "platform_tag": "win_amd64",
          "python_tag": "cp312",
          "url": "https://repo.radeon.com/rocm/windows/rocm-rel-6.4.4/torchaudio-2.6.0a0%2B1a8f621-cp312-cp312-win_amd64.whl#sha256=",
          "version": "2.6.0a0+1a8f621"
        },
        {
          "abi_tag": "cp312",
          "filename": "torchvision-0.24.0a0+c85f008-cp312-cp312-win_amd64.whl",
          "package": "torchvision",
          "platform_tag": "win_amd64",
          "python_tag": "cp312",
          "url": "https://repo.radeon.com/rocm/windows/rocm-rel-6.4.4/torchvision-0.24.0a0%2Bc85f008-cp312-cp312-win_amd64.whl#sha256=",
          "version": "0.24.0a0+c85f008"
        }
      ],
      "release_id": "6.4.4",
      "source_id": "legacy-windows-artifacts",
      "url": "https://repo.radeon.com/rocm/windows/rocm-rel-6.4.4/"
    },
    {
      "artifacts": [
        {
          "abi_tag": "source",
          "filename": "rocm-0.1.dev0.tar.gz",
          "package": "rocm",
          "platform_tag": "source",
          "python_tag": "source",
          "url": "https://repo.radeon.com/rocm/windows/rocm-rel-7.1.1/rocm-0.1.dev0.tar.gz",
          "version": "0.1.dev0"
        },
        {
          "abi_tag": "none",
          "filename": "rocm_sdk_core-0.1.dev0-py3-none-win_amd64.whl",
          "package": "rocm-sdk-core",
          "platform_tag": "win_amd64",
          "python_tag": "py3",
          "url": "https://repo.radeon.com/rocm/windows/rocm-rel-7.1.1/rocm_sdk_core-0.1.dev0-py3-none-win_amd64.whl",
          "version": "0.1.dev0"
        },
        {
          "abi_tag": "none",
          "filename": "rocm_sdk_devel-0.1.dev0-py3-none-win_amd64.whl",
          "package": "rocm-sdk-devel",
          "platform_tag": "win_amd64",
          "python_tag": "py3",
          "url": "https://repo.radeon.com/rocm/windows/rocm-rel-7.1.1/rocm_sdk_devel-0.1.dev0-py3-none-win_amd64.whl",
          "version": "0.1.dev0"
        },
        {
          "abi_tag": "none",
          "filename": "rocm_sdk_libraries_custom-0.1.dev0-py3-none-win_amd64.whl",
          "package": "rocm-sdk-libraries-custom",
          "platform_tag": "win_amd64",
          "python_tag": "py3",
          "url": "https://repo.radeon.com/rocm/windows/rocm-rel-7.1.1/rocm_sdk_libraries_custom-0.1.dev0-py3-none-win_amd64.whl",
          "version": "0.1.dev0"
        },
        {
          "abi_tag": "cp312",
          "filename": "torch-2.9.0+rocmsdk20251116-cp312-cp312-win_amd64.whl",
          "package": "torch",
          "platform_tag": "win_amd64",
          "python_tag": "cp312",
          "url": "https://repo.radeon.com/rocm/windows/rocm-rel-7.1.1/torch-2.9.0%2Brocmsdk20251116-cp312-cp312-win_amd64.whl",
          "version": "2.9.0+rocmsdk20251116"
        },
        {
          "abi_tag": "cp312",
          "filename": "torchaudio-2.9.0+rocmsdk20251116-cp312-cp312-win_amd64.whl",
          "package": "torchaudio",
          "platform_tag": "win_amd64",
          "python_tag": "cp312",
          "url": "https://repo.radeon.com/rocm/windows/rocm-rel-7.1.1/torchaudio-2.9.0%2Brocmsdk20251116-cp312-cp312-win_amd64.whl",
          "version": "2.9.0+rocmsdk20251116"
        },
        {
          "abi_tag": "cp312",
          "filename": "torchvision-0.24.0+rocmsdk20251116-cp312-cp312-win_amd64.whl",
          "package": "torchvision",
          "platform_tag": "win_amd64",
          "python_tag": "cp312",
          "url": "https://repo.radeon.com/rocm/windows/rocm-rel-7.1.1/torchvision-0.24.0%2Brocmsdk20251116-cp312-cp312-win_amd64.whl",
          "version": "0.24.0+rocmsdk20251116"
        }
      ],
      "release_id": "7.1.1",
      "source_id": "legacy-windows-artifacts",
      "url": "https://repo.radeon.com/rocm/windows/rocm-rel-7.1.1/"
    },
    {
      "artifacts": [
        {
          "abi_tag": "source",
          "filename": "rocm-7.2.0.dev0.tar.gz",
          "package": "rocm",
          "platform_tag": "source",
          "python_tag": "source",
          "url": "https://repo.radeon.com/rocm/windows/rocm-rel-7.2/rocm-7.2.0.dev0.tar.gz",
          "version": "7.2.0.dev0"
        },
        {
          "abi_tag": "none",
          "filename": "rocm_sdk_core-7.2.0.dev0-py3-none-win_amd64.whl",
          "package": "rocm-sdk-core",
          "platform_tag": "win_amd64",
          "python_tag": "py3",
          "url": "https://repo.radeon.com/rocm/windows/rocm-rel-7.2/rocm_sdk_core-7.2.0.dev0-py3-none-win_amd64.whl",
          "version": "7.2.0.dev0"
        },
        {
          "abi_tag": "none",
          "filename": "rocm_sdk_devel-7.2.0.dev0-py3-none-win_amd64.whl",
          "package": "rocm-sdk-devel",
          "platform_tag": "win_amd64",
          "python_tag": "py3",
          "url": "https://repo.radeon.com/rocm/windows/rocm-rel-7.2/rocm_sdk_devel-7.2.0.dev0-py3-none-win_amd64.whl",
          "version": "7.2.0.dev0"
        },
        {
          "abi_tag": "none",
          "filename": "rocm_sdk_libraries_custom-7.2.0.dev0-py3-none-win_amd64.whl",
          "package": "rocm-sdk-libraries-custom",
          "platform_tag": "win_amd64",
          "python_tag": "py3",
          "url": "https://repo.radeon.com/rocm/windows/rocm-rel-7.2/rocm_sdk_libraries_custom-7.2.0.dev0-py3-none-win_amd64.whl",
          "version": "7.2.0.dev0"
        },
        {
          "abi_tag": "cp312",
          "filename": "torch-2.9.1+rocmsdk20260116-cp312-cp312-win_amd64.whl",
          "package": "torch",
          "platform_tag": "win_amd64",
          "python_tag": "cp312",
          "url": "https://repo.radeon.com/rocm/windows/rocm-rel-7.2/torch-2.9.1%2Brocmsdk20260116-cp312-cp312-win_amd64.whl",
          "version": "2.9.1+rocmsdk20260116"
        },
        {
          "abi_tag": "cp312",
          "filename": "torchaudio-2.9.1+rocmsdk20260116-cp312-cp312-win_amd64.whl",
          "package": "torchaudio",
          "platform_tag": "win_amd64",
          "python_tag": "cp312",
          "url": "https://repo.radeon.com/rocm/windows/rocm-rel-7.2/torchaudio-2.9.1%2Brocmsdk20260116-cp312-cp312-win_amd64.whl",
          "version": "2.9.1+rocmsdk20260116"
        },
        {
          "abi_tag": "cp312",
          "filename": "torchvision-0.24.1+rocmsdk20260116-cp312-cp312-win_amd64.whl",
          "package": "torchvision",
          "platform_tag": "win_amd64",
          "python_tag": "cp312",
          "url": "https://repo.radeon.com/rocm/windows/rocm-rel-7.2/torchvision-0.24.1%2Brocmsdk20260116-cp312-cp312-win_amd64.whl",
          "version": "0.24.1+rocmsdk20260116"
        }
      ],
      "release_id": "7.2",
      "source_id": "legacy-windows-artifacts",
      "url": "https://repo.radeon.com/rocm/windows/rocm-rel-7.2/"
    },
    {
      "artifacts": [
        {
          "abi_tag": "source",
          "filename": "rocm-7.2.1.tar.gz",
          "package": "rocm",
          "platform_tag": "source",
          "python_tag": "source",
          "url": "https://repo.radeon.com/rocm/windows/rocm-rel-7.2.1/rocm-7.2.1.tar.gz",
          "version": "7.2.1"
        },
        {
          "abi_tag": "none",
          "filename": "rocm_sdk_core-7.2.1-py3-none-win_amd64.whl",
          "package": "rocm-sdk-core",
          "platform_tag": "win_amd64",
          "python_tag": "py3",
          "url": "https://repo.radeon.com/rocm/windows/rocm-rel-7.2.1/rocm_sdk_core-7.2.1-py3-none-win_amd64.whl",
          "version": "7.2.1"
        },
        {
          "abi_tag": "none",
          "filename": "rocm_sdk_devel-7.2.1-py3-none-win_amd64.whl",
          "package": "rocm-sdk-devel",
          "platform_tag": "win_amd64",
          "python_tag": "py3",
          "url": "https://repo.radeon.com/rocm/windows/rocm-rel-7.2.1/rocm_sdk_devel-7.2.1-py3-none-win_amd64.whl",
          "version": "7.2.1"
        },
        {
          "abi_tag": "none",
          "filename": "rocm_sdk_libraries_custom-7.2.1-py3-none-win_amd64.whl",
          "package": "rocm-sdk-libraries-custom",
          "platform_tag": "win_amd64",
          "python_tag": "py3",
          "url": "https://repo.radeon.com/rocm/windows/rocm-rel-7.2.1/rocm_sdk_libraries_custom-7.2.1-py3-none-win_amd64.whl",
          "version": "7.2.1"
        },
        {
          "abi_tag": "cp312",
          "filename": "torch-2.9.1+rocm7.2.1-cp312-cp312-win_amd64.whl",
          "package": "torch",
          "platform_tag": "win_amd64",
          "python_tag": "cp312",
          "url": "https://repo.radeon.com/rocm/windows/rocm-rel-7.2.1/torch-2.9.1%2Brocm7.2.1-cp312-cp312-win_amd64.whl",
          "version": "2.9.1+rocm7.2.1"
        },
        {
          "abi_tag": "cp312",
          "filename": "torchaudio-2.9.1+rocm7.2.1-cp312-cp312-win_amd64.whl",
          "package": "torchaudio",
          "platform_tag": "win_amd64",
          "python_tag": "cp312",
          "url": "https://repo.radeon.com/rocm/windows/rocm-rel-7.2.1/torchaudio-2.9.1%2Brocm7.2.1-cp312-cp312-win_amd64.whl",
          "version": "2.9.1+rocm7.2.1"
        },
        {
          "abi_tag": "cp312",
          "filename": "torchvision-0.24.1+rocm7.2.1-cp312-cp312-win_amd64.whl",
          "package": "torchvision",
          "platform_tag": "win_amd64",
          "python_tag": "cp312",
          "url": "https://repo.radeon.com/rocm/windows/rocm-rel-7.2.1/torchvision-0.24.1%2Brocm7.2.1-cp312-cp312-win_amd64.whl",
          "version": "0.24.1+rocm7.2.1"